{"$id":"https://awesome-self-skills.local/schemas/v5-storage-layout-registry.schema.json","$schema":"https://json-schema.org/draft/2020-12/schema","additionalProperties":false,"properties":{"catalog":{"additionalProperties":false,"properties":{"current_pointer":{"const":"catalog/current-transaction.json"},"idempotency_indexes":{"const":"catalog/objects/idempotency-indexes"},"receipts":{"const":"catalog/objects/receipts"},"replies":{"const":"catalog/objects/replies"},"run_genesis_records":{"const":"catalog/objects/run-genesis-records"},"runs":{"const":"runs"},"transactions":{"const":"catalog/objects/transactions"}},"required":["current_pointer","transactions","receipts","idempotency_indexes","replies","run_genesis_records","runs"],"type":"object"},"object_key_format":{"const":"sha256-lowercase-hex-json"},"path_rules":{"additionalProperties":false,"properties":{"forbid_backslash":{"const":true},"forbid_dot_segments":{"const":true},"forbid_empty_segments":{"const":true},"forbid_nul":{"const":true},"separator":{"const":"/"},"symlink_policy":{"const":"deny"}},"required":["separator","forbid_empty_segments","forbid_dot_segments","forbid_backslash","forbid_nul","symlink_policy"],"type":"object"},"publication_protocol":{"const":"write_temp_fsync_rename_directory_fsync_pointer_raw_bytes_cas"},"registry_digest":{"const":"sha256:cc3697a86b6e68818eab9955d7e33573e85957a751aaf246fae4fa1ab1ff5c10"},"registry_format_version":{"const":1},"run":{"additionalProperties":false,"properties":{"accepted_artifacts":{"const":"objects/accepted-artifacts"},"checkpoints":{"const":"objects/checkpoints"},"compiler_state":{"const":"objects/compiler-state"},"current_pointer":{"const":"current-transaction.json"},"events":{"const":"objects/events"},"idempotency_indexes":{"const":"objects/idempotency-indexes"},"identity":{"const":"identity.json"},"incidents":{"const":"objects/incidents"},"lock":{"const":".v5-run.lock"},"raw_source_bytes":{"const":"objects/raw-source-bytes"},"receipts":{"const":"objects/receipts"},"rendered_outputs":{"const":"objects/rendered-outputs"},"replies":{"const":"objects/replies"},"run_genesis_records":{"const":"objects/run-genesis-records"},"selector_sidecars":{"const":"objects/selector-sidecars"},"staging":{"const":".staging"},"transactions":{"const":"objects/transactions"}},"required":["identity","current_pointer","transactions","receipts","idempotency_indexes","replies","checkpoints","selector_sidecars","accepted_artifacts","compiler_state","rendered_outputs","events","incidents","run_genesis_records","raw_source_bytes","staging","lock"],"type":"object"},"schema_version":{"const":"5.0.0"}},"required":["schema_version","registry_format_version","path_rules","catalog","run","object_key_format","publication_protocol","registry_digest"],"type":"object"}
