{"catalog":{"current_pointer":"catalog/current-transaction.json","idempotency_indexes":"catalog/objects/idempotency-indexes","receipts":"catalog/objects/receipts","replies":"catalog/objects/replies","run_genesis_records":"catalog/objects/run-genesis-records","runs":"runs","transactions":"catalog/objects/transactions"},"object_key_format":"sha256-lowercase-hex-json","path_rules":{"forbid_backslash":true,"forbid_dot_segments":true,"forbid_empty_segments":true,"forbid_nul":true,"separator":"/","symlink_policy":"deny"},"publication_protocol":"write_temp_fsync_rename_directory_fsync_pointer_raw_bytes_cas","registry_digest":"sha256:cc3697a86b6e68818eab9955d7e33573e85957a751aaf246fae4fa1ab1ff5c10","registry_format_version":1,"run":{"accepted_artifacts":"objects/accepted-artifacts","checkpoints":"objects/checkpoints","compiler_state":"objects/compiler-state","current_pointer":"current-transaction.json","events":"objects/events","idempotency_indexes":"objects/idempotency-indexes","identity":"identity.json","incidents":"objects/incidents","lock":".v5-run.lock","raw_source_bytes":"objects/raw-source-bytes","receipts":"objects/receipts","rendered_outputs":"objects/rendered-outputs","replies":"objects/replies","run_genesis_records":"objects/run-genesis-records","selector_sidecars":"objects/selector-sidecars","staging":".staging","transactions":"objects/transactions"},"schema_version":"5.0.0"}
